{
  "$id": "plugin.schema.json",
  "$schema": "https://json-schema.org/draft/2020-12/schema",
  "title": "Claude Code Plugin Schema",
  "description": "Schema for validating individual Claude Code plugin manifests",
  "type": "object",
  "properties": {
    "name": {
      "type": "string",
      "pattern": "^[a-z0-9-]+$",
      "minLength": 1,
      "description": "Plugin name in kebab-case, must match marketplace entry"
    },
    "version": {
      "type": "string",
      "pattern": "^\\d+\\.\\d+\\.\\d+(-[a-zA-Z0-9.-]+)?$",
      "description": "Semver version string"
    },
    "description": {
      "type": "string",
      "minLength": 10,
      "maxLength": 500,
      "description": "Brief description of the plugin's capabilities"
    },
    "author": {
      "type": "object",
      "properties": {
        "name": {
          "type": "string",
          "minLength": 1
        },
        "email": {
          "type": "string",
          "format": "email"
        }
      },
      "required": ["name"],
      "additionalProperties": false
    },
    "repository": {
      "type": "string",
      "format": "uri",
      "description": "Repository URL as string"
    },
    "license": {
      "type": "string",
      "minLength": 1,
      "description": "SPDX license identifier or custom license name"
    }
  },
  "required": [
    "name",
    "version",
    "description",
    "author",
    "repository",
    "license"
  ],
  "additionalProperties": false
}
